{
  "schemaVersion": "1.0.0",
  "kind": "interaction-contract",
  "pageId": "f-fluid",
  "generatedAt": "2026-10-29T12:28:21.528Z",
  "driver": {
    "adapter": "web",
    "endpoint": null,
    "verification": "real-action-and-observation"
  },
  "checks": [
    {
      "id": "toggle-note",
      "title": "点按钮后说明展开",
      "steps": [
        {
          "tap": {
            "selector": "#f-more"
          }
        },
        {
          "wait": 150
        }
      ],
      "expect": {
        "textIncludes": {
          "selector": "#f-note",
          "text": "已展开"
        }
      },
      "screenshot": false,
      "status": "PASS",
      "observed": "ok text(#f-note) includes \"已展开\" → 说明已展开",
      "assertions": [
        {
          "assertion": "text(#f-note) includes \"已展开\"",
          "pass": true,
          "observed": "说明已展开"
        }
      ],
      "screenshotPath": null,
      "error": null,
      "verification": "real-action-and-observation"
    }
  ],
  "status": "PASS",
  "reason": null,
  "provenance": {
    "builtBy": "pf validate",
    "config": "pf.config.json#pages[].interactions"
  }
}
